{
  "$schema": "https://json-schema.org/draft/2020-12/schema",
  "$id": "https://sethmay.github.io/open-scout-api/schema/v1/camp.schema.json",
  "title": "Camp (canonical entity file)",
  "description": "One file per camp property: data/camps/<slug>.json. Registry + classification + history layer only — operational data (sessions, fees, dates, availability) stays in camp-finder / the council's own site, joined by camp id. A camp is classified on three orthogonal facets: camp_type (what kind of place, single), program_types (what it offers, set), and operator (+council; who runs it). Camp identity is independent of council ownership (camps change hands): council/operator are versioned attributes; sales/transfers are 'transferred' events, closures 'discontinued' events in data/camps/_events.json. Slugs keep camp-finder's state-prefixed convention (e.g. 'or-camp-meriwether').",
  "type": "object",
  "properties": {
    "$schema": { "type": "string", "format": "uri" },
    "id": { "$ref": "common.schema.json#/$defs/Slug" },
    "kind": { "const": "camp" },
    "versions": {
      "type": "array",
      "items": { "$ref": "#/$defs/CampVersion" },
      "minItems": 1,
      "description": "Chronologically ordered, non-overlapping snapshots (pipeline-enforced)."
    },
    "notes": {
      "type": ["string", "null"],
      "default": null
    }
  },
  "required": ["id", "kind", "versions"],
  "additionalProperties": false,
  "$defs": {
    "CampVersion": {
      "allOf": [{ "$ref": "common.schema.json#/$defs/VersionBase" }],
      "type": "object",
      "properties": {
        "name": {
          "type": "string",
          "minLength": 1
        },
        "camp_type": {
          "$ref": "common.schema.json#/$defs/VocabCode",
          "description": "Primary structural classification (single; open vocab). Canonical set: reservation (a multi-camp property), resident_camp, high_adventure_base, short_term_camp (weekend/primitive troop use), day_camp, program_center, other. Multi-use is expressed via program_types, not here."
        },
        "operator": {
          "enum": ["council", "national", "other", "unknown"],
          "description": "Ownership/operation tier. 'council' pairs with the council ref below; 'national' = a National Council property (e.g. Philmont, Florida Sea Base, Northern Tier, Summit Bechtel) with council null. Disambiguates a null council (national base vs genuinely unknown)."
        },
        "council": {
          "anyOf": [
            {
              "type": "string",
              "pattern": "^council:[a-z0-9]([a-z0-9-]*[a-z0-9])?$"
            },
            { "type": "null" }
          ],
          "description": "Owning/operating council during this window; null = unknown (common for historical camps)."
        },
        "parent": {
          "anyOf": [
            { "type": "string", "pattern": "^camp:[a-z0-9]([a-z0-9-]*[a-z0-9])?$" },
            { "type": "null" }
          ],
          "default": null,
          "description": "The reservation this camp belongs to, as a camp ref (a sub-camp of a scout reservation); null if standalone. Reservation children are populated in a later pass."
        },
        "operating_status": {
          "enum": ["active", "not_operating", "closed"],
          "description": "camp-finder semantics: 'not_operating' = property exists but no program; 'closed' = property gone/sold."
        },
        "address": {
          "type": ["string", "null"],
          "default": null
        },
        "city": {
          "type": ["string", "null"],
          "default": null
        },
        "state": {
          "anyOf": [
            { "$ref": "common.schema.json#/$defs/StateCode" },
            { "type": "null" }
          ],
          "default": null
        },
        "lat": {
          "type": ["number", "null"],
          "minimum": -90,
          "maximum": 90,
          "default": null
        },
        "lon": {
          "type": ["number", "null"],
          "minimum": -180,
          "maximum": 180,
          "default": null
        },
        "geo_precision": {
          "enum": ["exact", "approximate", null],
          "default": null,
          "description": "Confidence of lat/lon: 'exact' = camp-specific source point inside its state box; 'approximate' = city or state-centroid backfill (tools/geocode_camps.py); null = could not be placed. Consumers should soft-plot or bucket 'approximate' points."
        },
        "elevation_ft": {
          "type": ["integer", "null"],
          "default": null,
          "description": "Ground elevation at lat/lon in feet above sea level (Copernicus 90m DEM via open-meteo, tools/elevation.py), rounded to the nearest 10 ft. Inherits geo_precision: for an 'approximate' point this is the city/reservation-centroid elevation, not the camp's exact ground. null when lat/lon is null."
        },
        "july_high_f": {
          "type": ["integer", "null"],
          "default": null,
          "description": "Average daily high temperature in July in °F — a WorldClim v2.1 climate normal for 1970-2000, sampled at 30 arc-seconds (~1 km) from the camp's coordinate (tools/july_temp.py). Inherits geo_precision: for an 'approximate' point this describes the city/reservation centroid. A coastal or island camp whose cell is open water uses the nearest land cell. July is a fixed month (US resident-camp season) — still a real July value for overseas/equatorial camps, but not necessarily their camp season. null when lat/lon is null."
        },
        "july_low_f": {
          "type": ["integer", "null"],
          "default": null,
          "description": "Average overnight low temperature in July in °F — companion to july_high_f (same source, window, and caveats)."
        },
        "website": {
          "type": ["string", "null"],
          "format": "uri",
          "default": null,
          "description": "Authoritative council/camp page during this window."
        },
        "program_types": {
          "type": "array",
          "items": { "$ref": "common.schema.json#/$defs/VocabCode" },
          "uniqueItems": true,
          "default": [],
          "description": "Programs/audiences offered here (open vocab, multi-valued): scouts_bsa_resident, cub_resident, cub_day, webelos, high_adventure, short_term_camping, venturing, sea_scout, family_camping, training. A single property is often multi-use."
        },
        "features": {
          "type": "array",
          "uniqueItems": true,
          "default": [],
          "description": "What this camp offers — facilities, activities, accommodation, and program models — as coded entries from the open `camp-features` vocabulary. ONE namespace holds both widely-shared features (dining_hall) and long-tail differentiators (land_sailing): `code` is the only filterable key, and the vocabulary's `broader` field lets a consumer roll specific leaves up to coarse parents. Records only WHETHER the property offers something; dates, fees, session schedules, and availability stay at the council site. Always read alongside `features_verified_at` — an empty array by itself does NOT mean the camp offers none. Codes are unique per version (enforced by tools/validate_data.py).",
          "items": {
            "type": "object",
            "properties": {
              "code": { "$ref": "common.schema.json#/$defs/VocabCode" },
              "signature": {
                "type": "boolean",
                "default": false,
                "description": "This camp presents the feature as a headline draw — a reason to travel here. Deliberately per camp rather than per vocabulary term, because the same feature is table stakes in one region and a differentiator in another (a climbing tower in Colorado vs on the prairie)."
              },
              "note": {
                "type": ["string", "null"],
                "default": null,
                "description": "Optional short factual phrase for cases where the code alone under-describes the offering (e.g. 'Land sailers and sandboards on two miles of private beach'). Evergreen and non-promotional: no dates, fees, or session schedules; enforced by tools/validate_data.py."
              }
            },
            "required": ["code"],
            "additionalProperties": false
          }
        },
        "features_verified_at": {
          "type": ["string", "null"],
          "format": "date",
          "default": null,
          "description": "Date of the last deliberate features survey of this camp against its own sources — what makes `features` interpretable. The two vary independently: null + [] = never surveyed, nothing known; null + entries = incidental data from a bulk import, not a survey; date + entries = surveyed; date + [] = surveyed and the camp genuinely offers none of the vocabulary's features. Without this an unsurveyed camp is indistinguishable from an empty one, every 'has X' filter silently under-reports, and 'camps without X' is unanswerable."
        },
        "summary": {
          "type": ["string", "null"],
          "default": null,
          "description": "Evergreen, original-prose description (setting, size, and the kinds of programs offered). MUST NOT contain dates, fees, session schedules, or other transitory details; enforced by tools/validate_data.py."
        },
        "merged_from": {
          "type": "array",
          "items": { "$ref": "common.schema.json#/$defs/Slug" },
          "uniqueItems": true,
          "description": "Retired camp ids that resolve to this camp: program/session variants of the same physical property collapsed in, or a prior id this camp was renamed from. Any unioned programs/features live here; consumers resolve old ids via v1/camps/aliases.json."
        },
        "reservation": {
          "type": ["object", "null"],
          "properties": {
            "id": { "type": "string", "pattern": "^[a-z0-9]([a-z0-9-]*[a-z0-9])?$" },
            "name": { "type": ["string", "null"] }
          },
          "required": ["id"],
          "additionalProperties": false,
          "description": "Set when this camp shares a location with other distinct camps (a reservation centroid): a grouping so consumers render one reservation pin per property. `name` is null when the camps carry no common reservation name. Not a plottable entity. `id` is a STABLE OPAQUE GROUPING KEY — deliberately a bare slug, NOT a '{kind}:{slug}' EntityRef, because no reservation entity exists (contrast `council`, which is a real ref). Should a reservation dataset ever be added, it will reuse these exact slugs as its entity ids and any reference will arrive as a NEW additive field — this `id` will not change format or meaning. Group by it; do not parse it."
        }
      },
      "required": ["name", "council", "operating_status", "camp_type", "operator"],
      "unevaluatedProperties": false
    }
  }
}
