{
  "$schema": "https://sethmay.github.io/open-scout-api/schema/v1/camp.schema.json",
  "id": "mo-cub-scout-advancement-camp-at-camp-may",
  "kind": "camp",
  "versions": [
    {
      "valid_from": null,
      "valid_to": null,
      "name": "Cub Scout Advancement Camp at Camp May",
      "camp_type": "resident_camp",
      "operator": "council",
      "council": "council:greater-saint-louis-area",
      "parent": null,
      "operating_status": "active",
      "address": "Camp May, Beaumont Scout Reservation",
      "city": "High Ridge",
      "state": "MO",
      "lat": 38.42,
      "lon": -90.63,
      "geo_precision": "exact",
      "website": "https://stlbsa.org/camps/cub-scout-overnight-camps/",
      "program_types": [
        "cub_resident"
      ],
      "features": [],
      "summary": "Overnight Cub Scout resident camp in High Ridge, Missouri, focused on Wolf and Bear advancement.",
      "provenance": {
        "sources": [
          {
            "citation": "camp-finder council-312/mo-cub-scout-advancement-camp-at-camp-may (unofficial community dataset)"
          },
          {
            "url": "https://stlbsa.org/camps/cub-scout-overnight-camps/"
          },
          {
            "url": "https://stlbsa.org/camps/cub-scout-overnight-camps/"
          }
        ],
        "method": "imported",
        "verified_at": "2026-07-17",
        "imported_at": "2026-07-21",
        "confidence": 0.6,
        "notes": "Imported from camp-finder; raw description and sessions dropped (operational data stays at the council site). verified_at is camp-finder's own source-confirmation date; imported_at is when open-scout-api ingested it. The evergreen summary is original prose regenerated from that description, excluding dates/fees/schedules. camp_type classified from program_types."
      }
    }
  ],
  "notes": null
}
