{
  "$schema": "https://sethmay.github.io/open-scout-api/schema/v1/camp.schema.json",
  "id": "tx-bear-creek-scout-camp",
  "kind": "camp",
  "versions": [
    {
      "valid_from": null,
      "valid_to": null,
      "name": "Bear Creek Scout Camp",
      "camp_type": "resident_camp",
      "operator": "council",
      "council": "council:alamo-area",
      "parent": null,
      "operating_status": "active",
      "address": "125 Bear Creek Scout Rd W",
      "city": "Hunt",
      "state": "TX",
      "lat": 30.058937891444,
      "lon": -99.41733329681,
      "geo_precision": "exact",
      "elevation_ft": 1850,
      "july_high_f": 92,
      "july_low_f": 69,
      "website": "https://www.alamoareascouting.org/summer-camp/",
      "program_types": [
        "scouts_bsa_resident"
      ],
      "features": [],
      "summary": "Alamo Area Council's Scouts BSA resident summer camp near Hunt, Texas, offering Bear Claw, Ranger first-year, and traditional program tracks.",
      "provenance": {
        "sources": [
          {
            "citation": "camp-finder council-583/tx-bear-creek-scout-camp (unofficial community dataset)"
          },
          {
            "url": "https://www.alamoareascouting.org/summer-camp/"
          },
          {
            "url": "https://www.alamoareascouting.org/summer-camp/"
          }
        ],
        "method": "imported",
        "verified_at": "2026-07-17",
        "imported_at": "2026-07-21",
        "confidence": 0.6,
        "notes": "Imported from camp-finder; raw description and sessions dropped (operational data stays at the council site). verified_at is camp-finder's own source-confirmation date; imported_at is when open-scout-api ingested it. The evergreen summary is original prose regenerated from that description, excluding dates/fees/schedules. camp_type classified from program_types."
      }
    }
  ],
  "notes": null
}
