{
  "$schema": "https://sethmay.github.io/open-scout-api/schema/v1/camp.schema.json",
  "id": "la-camp-t-l-james",
  "kind": "camp",
  "versions": [
    {
      "valid_from": null,
      "valid_to": null,
      "name": "Camp T. L. James",
      "camp_type": "resident_camp",
      "operator": "council",
      "council": "council:louisiana-purchase",
      "parent": null,
      "operating_status": "active",
      "address": "105 Camp T.L. James Road, Downsville, LA 71234",
      "city": "Downsville",
      "state": "LA",
      "lat": 32.622507385596,
      "lon": -92.363576154802,
      "geo_precision": "exact",
      "elevation_ft": 280,
      "july_high_f": 92,
      "july_low_f": 70,
      "website": "https://www.louisianapurchasecouncil.org/summercamps",
      "program_types": [
        "scouts_bsa_resident"
      ],
      "features": [
        {
          "code": "air_conditioning",
          "note": "An air-conditioned dining hall."
        },
        {
          "code": "archery"
        },
        {
          "code": "atv",
          "note": "An ATV certification course on a dedicated track."
        },
        {
          "code": "bathhouse",
          "note": "Each campsite has an outhouse with showers."
        },
        {
          "code": "black_powder",
          "note": "The Louisiana Long Guns black-powder rifle program."
        },
        {
          "code": "canoeing"
        },
        {
          "code": "cit_program"
        },
        {
          "code": "cowboy_action_shooting"
        },
        {
          "code": "dining_hall"
        },
        {
          "code": "first_year_program",
          "note": "The Brownsea Island first-year camper program."
        },
        {
          "code": "fishing"
        },
        {
          "code": "handicraft"
        },
        {
          "code": "kayaking"
        },
        {
          "code": "nature_study"
        },
        {
          "code": "older_scout_program"
        },
        {
          "code": "platform_tents",
          "note": "Canvas wall tents can be checked out from the quartermaster."
        },
        {
          "code": "rifle"
        },
        {
          "code": "rowing"
        },
        {
          "code": "sailing"
        },
        {
          "code": "shotgun"
        },
        {
          "code": "swimming"
        },
        {
          "code": "water_blob"
        },
        {
          "code": "waterfront",
          "note": "A forty-acre lake, plus an upper lake for fishing."
        },
        {
          "code": "zip_line",
          "note": "A zip line across the lake ending in a splashdown."
        }
      ],
      "features_verified_at": "2026-07-25",
      "summary": "Scouts BSA resident summer camp in Downsville, Louisiana, offering a nationally accredited overnight camping program.",
      "provenance": {
        "sources": [
          {
            "citation": "camp-finder council-213/la-camp-t-l-james (unofficial community dataset)"
          },
          {
            "url": "https://www.louisianapurchasecouncil.org/summercamps"
          },
          {
            "url": "https://www.louisianapurchasecouncil.org/summercamps"
          },
          {
            "url": "https://www.louisianapurchasecouncil.org/TLJamesSummerCamp",
            "accessed": "2026-07-25"
          },
          {
            "url": "https://www.louisianapurchasecouncil.org/files/55809/Summer-Camp",
            "accessed": "2026-07-25"
          }
        ],
        "method": "imported",
        "verified_at": "2026-07-18",
        "imported_at": "2026-07-21",
        "confidence": 0.6,
        "notes": "Imported from camp-finder; raw description and sessions dropped (operational data stays at the council site). verified_at is camp-finder's own source-confirmation date; imported_at is when open-scout-api ingested it. The evergreen summary is original prose regenerated from that description, excluding dates/fees/schedules. camp_type classified from program_types. Features surveyed 2026-07-25 against the council's own camp page (that page is explicitly not an exhaustive activity list, so absence of a code is not evidence of absence)."
      }
    }
  ],
  "notes": null
}
