{
  "$schema": "https://sethmay.github.io/open-scout-api/schema/v1/camp.schema.json",
  "id": "pa-camp-acahela",
  "kind": "camp",
  "versions": [
    {
      "valid_from": null,
      "valid_to": null,
      "name": "Camp Acahela",
      "camp_type": "resident_camp",
      "operator": "council",
      "council": "council:northeastern-pennsylvania",
      "parent": null,
      "operating_status": "active",
      "address": "359 Acahela Road",
      "city": "Blakeslee",
      "state": "PA",
      "lat": 41.12146059686,
      "lon": -75.639451783765,
      "geo_precision": "exact",
      "elevation_ft": 1590,
      "july_high_f": 79,
      "july_low_f": 56,
      "website": "https://www.acahela.org/acahela-cub-camp",
      "program_types": [
        "cub_resident"
      ],
      "features": [],
      "summary": "Cub Scout resident camp on 250 acres of Pocono woodlands near Blakeslee, Pennsylvania, sited at the confluence of the Lehigh River and Tobyhanna Creek. Operated by the Northeastern Pennsylvania Council, with accommodations in two-person canvas tents.",
      "provenance": {
        "sources": [
          {
            "citation": "camp-finder council-501/pa-camp-acahela (unofficial community dataset)"
          },
          {
            "url": "https://www.acahela.org/acahela-cub-camp"
          },
          {
            "url": "https://www.acahela.org/acahela-cub-camp"
          }
        ],
        "method": "imported",
        "verified_at": "2026-07-17",
        "imported_at": "2026-07-21",
        "confidence": 0.6,
        "notes": "Imported from camp-finder; raw description and sessions dropped (operational data stays at the council site). verified_at is camp-finder's own source-confirmation date; imported_at is when open-scout-api ingested it. The evergreen summary is original prose regenerated from that description, excluding dates/fees/schedules. camp_type classified from program_types."
      }
    }
  ],
  "notes": null
}
