{
  "$schema": "https://sethmay.github.io/open-scout-api/schema/v1/camp.schema.json",
  "id": "md-rodney-scout-reservation",
  "kind": "camp",
  "versions": [
    {
      "valid_from": null,
      "valid_to": null,
      "name": "Rodney Scout Reservation",
      "camp_type": "resident_camp",
      "operator": "council",
      "council": "council:del-mar-va",
      "parent": null,
      "operating_status": "active",
      "address": "400 Rodney Scout Road North East, Maryland 21901",
      "city": null,
      "state": "MD",
      "lat": 39.5287252,
      "lon": -75.9549252,
      "geo_precision": "exact",
      "elevation_ft": 160,
      "july_high_f": 86,
      "july_low_f": 65,
      "website": "https://www.delmarvacouncil.org/rodney-scout-reservation/",
      "program_types": [
        "scouts_bsa_resident"
      ],
      "features": [
        {
          "code": "archery"
        },
        {
          "code": "climbing_tower",
          "note": "A thirty-foot climbing tower."
        },
        {
          "code": "first_year_program",
          "note": "The Brownsea first-year camper program."
        },
        {
          "code": "handicraft",
          "note": "Bull Mountain Studios covers handicraft plus moviemaking, photography, music, and graphic arts."
        },
        {
          "code": "high_adventure_option",
          "note": "Off-site high-adventure sailing on the Chesapeake for Scouts fourteen and older."
        },
        {
          "code": "knife_throwing"
        },
        {
          "code": "mountain_biking",
          "note": "Camp-provided mountain bikes in the health and fitness area."
        },
        {
          "code": "nature_center",
          "note": "The N.E.S.T. Center has computer and science laboratories."
        },
        {
          "code": "nature_study"
        },
        {
          "code": "older_scout_program",
          "note": "The Advanced Camper Experience for Scouts fourteen and older."
        },
        {
          "code": "pavilion",
          "note": "A Scoutcraft pavilion."
        },
        {
          "code": "pool",
          "note": "A pool with three deep ends."
        },
        {
          "code": "rappelling"
        },
        {
          "code": "rifle"
        },
        {
          "code": "sailing",
          "note": "A dedicated sailing base on the Chesapeake, with a regatta race."
        },
        {
          "code": "shotgun"
        },
        {
          "code": "stem"
        },
        {
          "code": "swimming"
        },
        {
          "code": "trading_post"
        },
        {
          "code": "waterfront",
          "signature": true,
          "note": "Over a mile of Chesapeake Bay shoreline; the only Scout camp on the bay."
        }
      ],
      "features_verified_at": "2026-07-25",
      "summary": null,
      "provenance": {
        "sources": [
          {
            "citation": "camp-finder council-081/md-rodney-scout-reservation (unofficial community dataset)"
          },
          {
            "url": "https://scoutingevent.com/081-RSRSummer"
          },
          {
            "url": "https://www.delmarvacouncil.org/rodney-scout-reservation/",
            "accessed": "2026-07-25"
          }
        ],
        "method": "imported",
        "verified_at": "2026-07-19",
        "imported_at": "2026-07-21",
        "confidence": 0.8,
        "notes": "Imported from camp-finder; raw description and sessions dropped (operational data stays at the council site). verified_at is camp-finder's own source-confirmation date; imported_at is when open-scout-api ingested it. The evergreen summary is original prose regenerated from that description, excluding dates/fees/schedules. camp_type classified from program_types. Website repaired 2026-07-25: the stored link was a registration portal (https://scoutingevent.com/081-RSRSummer); replaced with the council's own camp page, found by tools/find_camp_pages.py and confirmed to name the camp. Features surveyed 2026-07-25 against the council's own camp page (that page is explicitly not an exhaustive activity list, so absence of a code is not evidence of absence)."
      }
    }
  ],
  "notes": null
}
