{
  "$schema": "https://sethmay.github.io/open-scout-api/schema/v1/camp.schema.json",
  "id": "ga-scoutland",
  "kind": "camp",
  "versions": [
    {
      "valid_from": null,
      "valid_to": null,
      "name": "Scoutland",
      "camp_type": "day_camp",
      "operator": "council",
      "council": "council:northeast-georgia",
      "parent": null,
      "operating_status": "active",
      "address": "3685 Looper Lake Rd",
      "city": "Gainesville",
      "state": "GA",
      "lat": 34.339642,
      "lon": -83.879691,
      "geo_precision": "exact",
      "elevation_ft": 1190,
      "july_high_f": 88,
      "july_low_f": 67,
      "website": "https://www.nega-bsa.org/cs-twi-stem-cmp",
      "program_types": [
        "cub_day"
      ],
      "features": [],
      "features_verified_at": null,
      "summary": "Northeast Georgia Council's 140-acre Cub Scout day camp on Lake Lanier in Gainesville, Georgia.",
      "provenance": {
        "sources": [
          {
            "citation": "camp-finder council-101/ga-scoutland (unofficial community dataset)"
          },
          {
            "url": "https://www.nega-bsa.org/cs-twi-stem-cmp"
          },
          {
            "url": "https://www.nega-bsa.org/cs-twi-stem-cmp"
          }
        ],
        "method": "imported",
        "verified_at": "2026-07-17",
        "imported_at": "2026-07-21",
        "confidence": 0.6,
        "notes": "Imported from camp-finder; raw description and sessions dropped (operational data stays at the council site). verified_at is camp-finder's own source-confirmation date; imported_at is when open-scout-api ingested it. The evergreen summary is original prose regenerated from that description, excluding dates/fees/schedules. camp_type classified from program_types."
      }
    }
  ],
  "notes": null
}
