{
  "$schema": "https://sethmay.github.io/open-scout-api/schema/v1/camp.schema.json",
  "id": "ut-camp-tracy",
  "kind": "camp",
  "versions": [
    {
      "valid_from": null,
      "valid_to": null,
      "name": "Camp Tracy",
      "camp_type": "day_camp",
      "operator": "council",
      "council": "council:crossroads-of-the-west",
      "parent": null,
      "operating_status": "active",
      "address": null,
      "city": "Salt Lake City",
      "state": "UT",
      "lat": 40.6946,
      "lon": -111.7483,
      "geo_precision": "exact",
      "elevation_ft": 5630,
      "july_high_f": 86,
      "july_low_f": 53,
      "website": "https://www.utahscouts.org/tracy",
      "program_types": [
        "cub_day"
      ],
      "features": [],
      "summary": "Cub Scout and Webelos day camp in Millcreek Canyon, Salt Lake County, Utah, offering a nature trail, BB guns, archery, and rowboats.",
      "provenance": {
        "sources": [
          {
            "citation": "camp-finder council-590/ut-camp-tracy (unofficial community dataset)"
          },
          {
            "url": "https://www.utahscouts.org/tracy"
          },
          {
            "url": "https://www.utahscouts.org/tracy"
          }
        ],
        "method": "imported",
        "verified_at": "2026-07-17",
        "imported_at": "2026-07-21",
        "confidence": 0.6,
        "notes": "Imported from camp-finder; raw description and sessions dropped (operational data stays at the council site). verified_at is camp-finder's own source-confirmation date; imported_at is when open-scout-api ingested it. The evergreen summary is original prose regenerated from that description, excluding dates/fees/schedules. camp_type classified from program_types."
      }
    }
  ],
  "notes": null
}
