{
  "$schema": "https://sethmay.github.io/open-scout-api/schema/v1/camp.schema.json",
  "id": "wv-camp-lynn",
  "kind": "camp",
  "versions": [
    {
      "valid_from": null,
      "valid_to": null,
      "name": "Camp Lynn",
      "camp_type": "short_term_camp",
      "operator": "council",
      "council": "council:mountaineer-area",
      "parent": null,
      "operating_status": "active",
      "address": "Boy Scout Road, Morgantown, WV 26508",
      "city": "Morgantown",
      "state": "WV",
      "lat": 39.5063,
      "lon": -79.8725,
      "geo_precision": "approximate",
      "elevation_ft": 1920,
      "july_high_f": null,
      "july_low_f": null,
      "website": "https://mountaineerscouting.org/",
      "program_types": [
        "short_term_camping"
      ],
      "features": [],
      "features_verified_at": null,
      "summary": "A rustic Mountaineer Area Council camping facility near Camp Mountaineer south of Morgantown, West Virginia, with wooded hills, natural streams, and primitive sites suited to backpacking and troop camping.",
      "provenance": {
        "sources": [
          {
            "url": "https://legacy-macbsa.azurewebsites.net/camp-lynn/",
            "accessed": "2026-08-14"
          },
          {
            "citation": "Added 2026-08-14 (method: curated) from a coverage gap surfaced by the scout-camp-map project; council/status re-verified against the Mountaineer Area Council's own Camp Lynn page and the Camp Mountaineer site map, which references Camp Lynn as a separate MAC property. Council confirmed as Mountaineer Area (matches the source hint); de-duped against the existing wv-camp-mountaineer record, which is a distinct nearby property. Coordinates from scout-camp-map, approximate; elevation from open-meteo. Features unsurveyed; July normals pending a WorldClim resample."
          }
        ],
        "method": "curated",
        "verified_at": "2026-08-14",
        "imported_at": "2026-08-14",
        "confidence": 0.7,
        "notes": "Coverage add: existence and council verified; distinct from Camp Mountaineer. camp_type/program_types classified conservatively as a primitive/troop-camping property; features unsurveyed."
      }
    }
  ],
  "notes": null
}
