{
  "$schema": "https://sethmay.github.io/open-scout-api/schema/v1/camp.schema.json",
  "id": "ae-camp-freedom",
  "kind": "camp",
  "versions": [
    {
      "valid_from": null,
      "valid_to": null,
      "name": "Camp Freedom",
      "camp_type": "resident_camp",
      "operator": "council",
      "council": "council:transatlantic",
      "parent": null,
      "operating_status": "active",
      "address": "Frankenkaserne (Camp Freedom), 91613 Marktbergel, Germany",
      "city": "Marktbergel",
      "state": "AE",
      "lat": 49.4268236,
      "lon": 10.3852889,
      "geo_precision": "exact",
      "elevation_ft": 1530,
      "july_high_f": 73,
      "july_low_f": 54,
      "website": "https://tacscouting.org/camps/",
      "program_types": [
        "cub_resident"
      ],
      "features": [],
      "features_verified_at": null,
      "summary": "Council-owned Cub Scout resident camp near Marktbergel/Oberdachstetten, Germany, operated by the Transatlantic Council. Also hosts Order of the Arrow weekends and family camping.",
      "provenance": {
        "sources": [
          {
            "citation": "camp-finder council-802/ae-camp-freedom (unofficial community dataset)"
          },
          {
            "url": "https://tacscouting.org/camps/"
          }
        ],
        "method": "imported",
        "verified_at": "2026-07-19",
        "imported_at": "2026-07-21",
        "confidence": 0.8,
        "notes": "Imported from camp-finder; raw description and sessions dropped (operational data stays at the council site). verified_at is camp-finder's own source-confirmation date; imported_at is when open-scout-api ingested it. The evergreen summary is original prose regenerated from that description, excluding dates/fees/schedules. camp_type classified from program_types."
      }
    }
  ],
  "notes": null
}
