{
  "$schema": "https://sethmay.github.io/open-scout-api/schema/v1/camp.schema.json",
  "id": "al-camp-orear",
  "kind": "camp",
  "versions": [
    {
      "valid_from": null,
      "valid_to": null,
      "name": "Camp O'Rear",
      "camp_type": "short_term_camp",
      "operator": "council",
      "council": "council:black-warrior",
      "parent": null,
      "operating_status": "active",
      "address": "2180 Curry Highway, Jasper, AL 35501",
      "city": "Jasper",
      "state": "AL",
      "lat": 33.9142109,
      "lon": -87.2527175,
      "geo_precision": "exact",
      "elevation_ft": 540,
      "july_high_f": null,
      "july_low_f": null,
      "website": "https://www.bwc-bsa.org/facilities",
      "program_types": [
        "short_term_camping"
      ],
      "features": [],
      "features_verified_at": null,
      "summary": "A 90-acre primitive-style Black Warrior Council camp near Jasper, Alabama, owned and operated by the council along Black Water Creek, with a small dining hall, a troop lodge, a large creekside pavilion, and a swinging bridge amid diverse Alabama woodland.",
      "provenance": {
        "sources": [
          {
            "url": "https://www.bwc-bsa.org/facilities",
            "accessed": "2026-08-14"
          },
          {
            "citation": "Added 2026-08-14 (method: curated) from a coverage gap surfaced by the scout-camp-map project; council/status re-verified from the Black Warrior Council's own Facilities page, which describes Camp O'Rear as council-owned and operated. Coordinates geocoded via US Census (exact); elevation from open-meteo. Features unsurveyed; July normals pending a WorldClim resample."
          }
        ],
        "method": "curated",
        "verified_at": "2026-08-14",
        "imported_at": "2026-08-14",
        "confidence": 0.72
      }
    }
  ],
  "notes": null
}
