{
  "$schema": "https://sethmay.github.io/open-scout-api/schema/v1/camp.schema.json",
  "id": "oh-camp-manatoc",
  "kind": "camp",
  "versions": [
    {
      "valid_from": null,
      "valid_to": null,
      "name": "Camp Manatoc",
      "camp_type": "resident_camp",
      "operator": "council",
      "council": "council:great-trail",
      "parent": null,
      "operating_status": "active",
      "address": "1075 Truxell Rd Peninsula, Ohio 44264",
      "city": null,
      "state": "OH",
      "lat": 41.2274074,
      "lon": -81.5343431,
      "geo_precision": "exact",
      "elevation_ft": 910,
      "july_high_f": 82,
      "july_low_f": 61,
      "website": "https://scoutingevent.com/433-manatoc2026",
      "program_types": [
        "scouts_bsa_resident"
      ],
      "features": [],
      "features_verified_at": null,
      "summary": null,
      "provenance": {
        "sources": [
          {
            "citation": "camp-finder council-433/oh-summer-camp-at-camp-manatoc-2026-scouts-bsa (unofficial community dataset)"
          },
          {
            "url": "https://scoutingevent.com/433-manatoc2026"
          },
          {
            "url": "https://scoutingevent.com/433-manatoc2026"
          }
        ],
        "method": "curated",
        "verified_at": "2026-07-22",
        "imported_at": "2026-07-21",
        "confidence": 0.8,
        "notes": "Name corrected 2026-07-22 (community/data-quality review): 'Summer Camp at Camp Manatoc 2026 (Scouts BSA)' was a scraped registration-event title; renamed to the property name, verified against the council's camp listing. Prior id 'oh-summer-camp-at-camp-manatoc-2026-scouts-bsa' retired (resolves via aliases.json). Imported from camp-finder; raw description and sessions dropped (operational data stays at the council site). verified_at is camp-finder's own source-confirmation date; imported_at is when open-scout-api ingested it. The evergreen summary is original prose regenerated from that description, excluding dates/fees/schedules. camp_type classified from program_types."
      },
      "merged_from": [
        "oh-summer-camp-at-camp-manatoc-2026-scouts-bsa"
      ]
    }
  ],
  "notes": null
}
