{
  "$schema": "https://sethmay.github.io/open-scout-api/schema/v1/camp.schema.json",
  "id": "ok-kerr-scout-ranch-at-slippery-falls",
  "kind": "camp",
  "versions": [
    {
      "valid_from": null,
      "valid_to": null,
      "name": "Kerr Scout Ranch at Slippery Falls",
      "camp_type": "resident_camp",
      "operator": "council",
      "council": "council:last-frontier",
      "parent": null,
      "operating_status": "active",
      "address": "4500 S. Bullet Prairie Road",
      "city": "Tishomingo",
      "state": "OK",
      "lat": 34.310062362626,
      "lon": -96.7233350509,
      "geo_precision": "exact",
      "elevation_ft": 880,
      "july_high_f": 93,
      "july_low_f": 71,
      "website": "https://www.scoutingevent.com/480-KSRSFSUMMERCAMP2026",
      "program_types": [
        "scouts_bsa_resident"
      ],
      "features": [],
      "features_verified_at": null,
      "summary": "Last Frontier Council's Scouts BSA resident summer camp near Tishomingo, Oklahoma.",
      "provenance": {
        "sources": [
          {
            "citation": "camp-finder council-480/ok-kerr-scout-ranch-at-slippery-falls (unofficial community dataset)"
          },
          {
            "url": "https://www.scoutingevent.com/480-KSRSFSUMMERCAMP2026"
          }
        ],
        "method": "imported",
        "verified_at": "2026-07-17",
        "imported_at": "2026-07-21",
        "confidence": 0.6,
        "notes": "Imported from camp-finder; raw description and sessions dropped (operational data stays at the council site). verified_at is camp-finder's own source-confirmation date; imported_at is when open-scout-api ingested it. The evergreen summary is original prose regenerated from that description, excluding dates/fees/schedules. camp_type classified from program_types."
      }
    }
  ],
  "notes": null
}
