{
  "$schema": "https://sethmay.github.io/open-scout-api/schema/v1/camp.schema.json",
  "id": "fl-camp-soule",
  "kind": "camp",
  "versions": [
    {
      "valid_from": null,
      "valid_to": null,
      "name": "Camp Soule",
      "camp_type": "day_camp",
      "operator": "council",
      "council": "council:greater-tampa-bay-area",
      "parent": null,
      "operating_status": "active",
      "address": "2201 Soule Road",
      "city": "Clearwater",
      "state": "FL",
      "lat": 27.999845,
      "lon": -82.721141,
      "geo_precision": "exact",
      "elevation_ft": 100,
      "july_high_f": 90,
      "july_low_f": 74,
      "website": "https://scoutingevent.com/089-CubDayCamp2026",
      "program_types": [
        "cub_day"
      ],
      "features": [],
      "features_verified_at": null,
      "summary": "Cub Scout day camp in Pinellas County offering crafts, nature walks, archery, and more for youth entering grades 1–5.",
      "provenance": {
        "sources": [
          {
            "citation": "camp-finder council-089/fl-camp-soule (unofficial community dataset)"
          },
          {
            "url": "https://scoutingevent.com/089-CubDayCamp2026"
          }
        ],
        "method": "imported",
        "verified_at": "2026-07-17",
        "imported_at": "2026-07-21",
        "confidence": 0.6,
        "notes": "Imported from camp-finder; raw description and sessions dropped (operational data stays at the council site). verified_at is camp-finder's own source-confirmation date; imported_at is when open-scout-api ingested it. The evergreen summary is original prose regenerated from that description, excluding dates/fees/schedules. camp_type classified from program_types."
      }
    }
  ],
  "notes": null
}
