{
  "$schema": "https://sethmay.github.io/open-scout-api/schema/v1/camp.schema.json",
  "id": "oh-camp-lazarus",
  "kind": "camp",
  "versions": [
    {
      "valid_from": null,
      "valid_to": null,
      "name": "Camp Lazarus",
      "camp_type": "day_camp",
      "operator": "council",
      "council": "council:simon-kenton",
      "parent": null,
      "operating_status": "active",
      "address": null,
      "city": "Delaware",
      "state": "OH",
      "lat": 40.2331,
      "lon": -83.0454,
      "geo_precision": "exact",
      "elevation_ft": 960,
      "july_high_f": 84,
      "july_low_f": 62,
      "website": "https://skcscouts.org/camps/summercamps/cub-scout-day-camp/",
      "program_types": [
        "cub_day"
      ],
      "features": [],
      "features_verified_at": null,
      "summary": "Simon Kenton Council Cub Scout day camp site located north of Columbus in Delaware, Ohio, hosting district day camps and a STEM day camp.",
      "provenance": {
        "sources": [
          {
            "citation": "camp-finder council-441/oh-camp-lazarus (unofficial community dataset)"
          },
          {
            "url": "https://skcscouts.org/camps/summercamps/cub-scout-day-camp/"
          }
        ],
        "method": "imported",
        "verified_at": "2026-07-17",
        "imported_at": "2026-07-21",
        "confidence": 0.6,
        "notes": "Imported from camp-finder; raw description and sessions dropped (operational data stays at the council site). verified_at is camp-finder's own source-confirmation date; imported_at is when open-scout-api ingested it. The evergreen summary is original prose regenerated from that description, excluding dates/fees/schedules. camp_type classified from program_types."
      }
    }
  ],
  "notes": null
}
